{
  "$schema": "./schema/behavioral.schema.json",
  "status_options": [
    {
      "id": "draft",
      "label": "Draft"
    },
    {
      "id": "rehearsing",
      "label": "Rehearsing"
    },
    {
      "id": "ready",
      "label": "Ready"
    }
  ],
  "pitch": {
    "target_sec": 90,
    "beats": [
      {
        "label": "Who",
        "text": "I'm Anuvik, an infrastructure engineer who now builds agentic AI systems. I spent nearly 3 years at Oracle as a Software Engineer II on NSX, working on observability, incident response, and Kubernetes across 37,000+ tenants."
      },
      {
        "label": "Proof",
        "text": "At Oracle, my API diagnostics gave on-call engineers root-cause tags and runbook context. P1 MTTR went from 94 to 26 minutes. Moving alerting toward SLOs also cut false pages 41%."
      },
      {
        "label": "Pivot",
        "text": "I came to USC for my MS to deepen my AI skills. At MSRcosmos this summer, I shipped a Claude and LangGraph ERP migration workflow with confidence-based review. It auto-approved 83% of records and reduced turnaround from 3 days to 5.5 hours."
      },
      {
        "label": "Now",
        "text": "Now I build a multi-agent retail intelligence app at USC Annenberg and benchmark LLM factual accuracy at the AI Trust Lab."
      },
      {
        "label": "Why you",
        "text": "From our team context, the role connects public-cloud engineering with AI SRE. I bring the perspective of the engineer getting paged and the engineer building agents, and I would like to understand where that combination is most useful to your team."
      }
    ],
    "closing_line": "That is the work I want to do next: reliable AI tools that help engineers resolve incidents faster."
  },
  "competencies": [
    {
      "id": "ownership",
      "name": "Ownership and impact",
      "gap": false
    },
    {
      "id": "technical-depth",
      "name": "Technical depth",
      "gap": false
    },
    {
      "id": "customer",
      "name": "Customer focus",
      "gap": false
    },
    {
      "id": "influence",
      "name": "Influence without authority",
      "gap": false
    },
    {
      "id": "ambiguity",
      "name": "Ambiguity and judgment",
      "gap": false
    },
    {
      "id": "data-driven",
      "name": "Data-driven decisions",
      "gap": false
    },
    {
      "id": "learning",
      "name": "Learning fast",
      "gap": false
    },
    {
      "id": "failure",
      "name": "Failure or mistake",
      "gap": true,
      "template": {
        "s": "Look in your Oracle deploys before the CLI toolchain existed, or an early MSRcosmos agent run that posted wrong. What broke, and who felt it?",
        "t": "What were you on the hook for when it broke?",
        "a": "What did you do in the first hour, and what did you change so it could not happen the same way again?",
        "r": "The fix, the number if there is one, and the one habit you kept. End on what you do differently now."
      }
    },
    {
      "id": "conflict",
      "name": "Conflict or disagreement",
      "gap": true,
      "template": {
        "s": "A teammate or another team disagreed with a technical call. Candidates: SLO alerting replacing thresholds, or a team resisting the CLI validation gate.",
        "t": "What decision was at stake, and who owned it?",
        "a": "How you understood their position first, what data you brought, and how you reached a decision. Name the compromise if there was one.",
        "r": "What shipped, how the relationship ended up, and what you learned about disagreeing well."
      }
    },
    {
      "id": "mentoring",
      "name": "Mentoring or growing others",
      "gap": true,
      "template": {
        "s": "Someone newer than you: an engineer onboarding to the CLI toolchain, a new on-call engineer using your runbooks, or a lab teammate.",
        "t": "What did they need to get to, and by when?",
        "a": "How you taught it: pairing, docs, reviews. Be specific about one thing you did.",
        "r": "What they could do on their own afterward. A number if you have one, a concrete outcome if not."
      }
    }
  ],
  "stories": [
    {
      "id": "annenberg-pacsun",
      "title": "Multi-agent retail intelligence app for PacSun executives",
      "experience_id": "annenberg",
      "prompts": [
        "Tell me about what you are building now.",
        "How do you connect LLM agents to company data safely?",
        "How do you know an AI-written brief is accurate?"
      ],
      "competencies": [
        "learning",
        "customer",
        "ambiguity"
      ],
      "values": [
        "innovation",
        "customer-success"
      ],
      "number_ids": [],
      "resume_lines": [
        "Building a multi-agent retail intelligence app on Claude Enterprise for PacSun executives, wiring MCP connectors into internal systems so agents pull live context, rank operational issues into one owner-tagged view, and draft CEO briefs."
      ],
      "s": "PacSun executives had to chase many teams to see which operational issues mattered and who owned them.",
      "t": "Build a multi-agent app on Claude Enterprise that pulls live context from internal systems and turns it into decisions.",
      "a": [
        "Wired MCP connectors into internal systems so agents read live data instead of stale exports.",
        "Agents rank operational issues into one view, each tagged with its owner.",
        "A writing step drafts CEO briefs from that ranked view."
      ],
      "r": "This is ongoing work, so I describe it as a live build rather than a finished result. The design point I can defend today is that each agent has one job and every brief traces back to the system it came from.",
      "probes": [
        {
          "q": "How do agents get live data?",
          "a": "Through MCP connectors: each one exposes a small set of tools into one system, with access scoped to what the agent needs."
        },
        {
          "q": "How do you stop a wrong brief from reaching the CEO?",
          "a": "Every claim in the brief should cite the system it came from, and a person reviews the brief before it goes to the CEO. The agents draft; they do not publish on their own."
        },
        {
          "q": "Why several agents instead of one?",
          "a": "Separate jobs: gather, rank, write. Each is easier to test and fix on its own."
        }
      ],
      "terms": [
        "Claude Enterprise: Claude for organizations, with admin controls and data protections.",
        "MCP connector: a plug that lets Claude read from a company system, like a database or a ticketing tool.",
        "Owner-tagged view: every issue shows who is responsible for it.",
        "CEO brief: a short summary of what matters and what needs a decision."
      ],
      "stack": [
        "Claude Enterprise: the LLM platform the agents run on.",
        "MCP connectors: the bridge into internal systems.",
        "Human review: a person checks each brief before it reaches the CEO."
      ],
      "simple": [
        "Executives had to chase many teams to see what was wrong.",
        "I connected Claude to internal systems through MCP so agents read live data.",
        "Agents rank issues and tag each with an owner.",
        "Another step drafts a CEO brief from that view."
      ]
    },
    {
      "id": "annenberg-scheduling",
      "title": "Agentic scheduling workflow for CEO meetings",
      "experience_id": "annenberg",
      "prompts": [
        "Tell me about an agent that takes actions, not just answers.",
        "How do you keep an agent from doing the wrong thing?"
      ],
      "competencies": [
        "ambiguity",
        "customer"
      ],
      "values": [
        "innovation",
        "customer-success"
      ],
      "number_ids": [],
      "resume_lines": [
        "Engineered an agentic scheduling workflow that ranks open issues by urgency and owner and proposes CEO meeting slots with agendas."
      ],
      "s": "The CEO's time is the scarcest resource, and open issues competed for it without a clear order.",
      "t": "Turn the ranked issue list into proposed meetings with the right people and a clear agenda.",
      "a": [
        "The workflow ranks open issues by urgency and owner.",
        "It proposes CEO meeting slots for the top issues.",
        "It drafts an agenda for each proposed meeting.",
        "Proposals go to a person for approval; nothing is booked automatically."
      ],
      "r": "This is ongoing work. The result I can speak to is the design: ranked issues turn into proposed slots with an agenda, and a person keeps the final decision.",
      "probes": [
        {
          "q": "What stops it from booking the wrong meeting?",
          "a": "It proposes, a person decides. The workflow drafts the slot and the agenda, and booking stays a human step."
        },
        {
          "q": "How do you rank urgency?",
          "a": "Urgency and ownership come from the ranked issue view the PacSun app already produces. I keep the ranking explainable so the person approving a meeting can see why an issue is at the top."
        }
      ],
      "terms": [
        "Agentic workflow: an LLM that plans and takes steps toward a goal, not just a one-shot answer.",
        "Urgency ranking: ordering issues by how soon they need action.",
        "Agenda: the topics and decisions for a meeting, written down in advance."
      ],
      "stack": [
        "Claude: plans and drafts the proposals.",
        "Owner-tagged issue view: the input it ranks.",
        "Human approval: a person confirms each proposed meeting before it is booked."
      ],
      "simple": [
        "Open issues had no clear order for the CEO's time.",
        "The workflow ranks issues by urgency and owner.",
        "It proposes meeting slots and drafts an agenda for each.",
        "A person approves before anything is booked."
      ]